{
  "browser_runtime": {
    "generation_root": "/opt/dispatch/browser-runtimes",
    "install_phase": "setup",
    "ready": false,
    "selector": "/etc/dispatch/browser-runtime-active.json"
  },
  "builtin_plugins": [],
  "core": {
    "artifact": {
      "sha256": null,
      "size": null,
      "url": null
    },
    "name": "dispatch-core",
    "package_files": [
      {
        "path": "dispatch_core/__init__.py",
        "sha256": "d76e4b6d0d0a9926e128130588b25e2f4b75a7852877049faa6938618493ae34"
      },
      {
        "path": "dispatch_core/authentication/__init__.py",
        "sha256": "8904bfa96ad69ff1d7585a692db9bad41d36af61c2345a8326731a2929d3ebfa"
      },
      {
        "path": "dispatch_core/authentication/workflow.py",
        "sha256": "17bbf3eda7842a09d82dcee5aff2615f72929f4645c2257d90ff58199b72bdc5"
      },
      {
        "path": "dispatch_core/browser_manager/__init__.py",
        "sha256": "343f2316c2475f1e19de5ce75a87e24b3cb1e1802fe72ac7060211d53d40073a"
      },
      {
        "path": "dispatch_core/browser_manager/manager.py",
        "sha256": "4a7af653575c79ee0c452a32a2cb0b3f83be03c921d449472e436474094dc7c9"
      },
      {
        "path": "dispatch_core/browser_manager/models.py",
        "sha256": "82143c2c3f3594cdcd874a46608a7f267e47fb490bbd1c3ccb01c058cc1d95d8"
      },
      {
        "path": "dispatch_core/browser_manager/policy.py",
        "sha256": "5af803255fbf5b9e8fad5364a227de068d0e3584ad22cd14f802fa1e4265152a"
      },
      {
        "path": "dispatch_core/browser_manager/runtime.py",
        "sha256": "9f5b88489832f89722be329fcb3b3348b0ebe5998100e36586854415d1e5e425"
      },
      {
        "path": "dispatch_core/browser_manager/runtime_authority.py",
        "sha256": "bacec89b43e9ea76898ff1efffb3840f37b8b614fb4e3a2f89bc4d5b9a47ba58"
      },
      {
        "path": "dispatch_core/browser_manager/store.py",
        "sha256": "d372d7aecccab71e8a23790658c3ef33bcb0d861f9812e2bbc9476d11028105e"
      },
      {
        "path": "dispatch_core/collection_manager/__init__.py",
        "sha256": "e72ba3542af409e63b474ca0d24b34ac4e3916337c97641f31c668ecf7a4495a"
      },
      {
        "path": "dispatch_core/collection_manager/queue.py",
        "sha256": "c114a1fdeead4213ee62166c2f8e6492fff7e9c348873042abcfa4eb6d7d2e5e"
      },
      {
        "path": "dispatch_core/collection_manager/supervisor.py",
        "sha256": "1782ba65fa62abb4b79e41e5a3e24c31aefc469beb0da51a38e4240743e92cf9"
      },
      {
        "path": "dispatch_core/command_interface/__init__.py",
        "sha256": "71d1bba4b8b2536f98ba4c49bf2cf0f4317a3784efd007d291d79a179a53e1a7"
      },
      {
        "path": "dispatch_core/command_interface/__main__.py",
        "sha256": "0472e2ffee01c7582c667fb3eb1ef01023e7d584f175cef8cb475e45e6bd1736"
      },
      {
        "path": "dispatch_core/health/__init__.py",
        "sha256": "827767fc37d0be7a1ae54c5e8bb93beeef4bee2bdb006711ff01ba302a88e91e"
      },
      {
        "path": "dispatch_core/paths/__init__.py",
        "sha256": "1f3f6f6b6e5d86900a0d4d350c5e94fb5f8d66eb0c3b7c41b9a40de6670851ff"
      },
      {
        "path": "dispatch_core/plugin_runtime.py",
        "sha256": "a8d32e73cb707d1058aee9dab22608b9d0faa31c2f343716b6aa65a72cf63dd3"
      }
    ],
    "requires_dist": [
      "cryptography==50.0.0; extra == \"authentication\"",
      "playwright==1.62.0; extra == \"browser\"",
      "attrs==26.1.0; extra == \"dev\"",
      "iniconfig==2.3.0; extra == \"dev\"",
      "jsonschema==4.26.0; extra == \"dev\"",
      "jsonschema-specifications==2025.9.1; extra == \"dev\"",
      "packaging==26.3; extra == \"dev\"",
      "pluggy==1.6.0; extra == \"dev\"",
      "Pygments==2.20.0; extra == \"dev\"",
      "pytest==9.1.1; extra == \"dev\"",
      "PyYAML==6.0.3; extra == \"dev\"",
      "referencing==0.37.0; extra == \"dev\"",
      "rpds-py==2026.6.3; extra == \"dev\"",
      "typing_extensions==4.16.0; extra == \"dev\""
    ],
    "version": "1.0.0"
  },
  "installer": {
    "artifact": {
      "sha256": null,
      "size": null,
      "url": null
    },
    "name": "dispatch-installer",
    "version": "0.1.1"
  },
  "post_install": {
    "choices": [
      "start_setup",
      "skip_for_now"
    ],
    "setup_command": "dispatch setup",
    "setup_implemented": true
  },
  "product": {
    "name": "dispatch",
    "version": "0.0.2"
  },
  "ready": false,
  "schema_version": 1,
  "uninstall": {
    "administrative_command": "dispatch-installer uninstall",
    "default_mode": "keep-data",
    "future_user_command": "dispatch uninstall",
    "privileged_browser_removal_implemented": false,
    "purge_requires_confirmation": true,
    "user_scope_implemented": true
  }
}
